{
  "apiVersion": "omca.dev/v1alpha1",
  "kind": "HostKnowledge",
  "metadata": {
    "id": "codex:cli:0.144",
    "host": "codex",
    "surface": "cli",
    "versionRange": ">=0.144.0 <0.145.0",
    "platforms": ["darwin-arm64"],
    "observedAt": "2026-07-16",
    "recheckAfter": "2026-08-16",
    "status": "FRESH"
  },
  "evidence": [
    {
      "id": "codex-environment-variables",
      "kind": "official-doc",
      "url": "https://learn.chatgpt.com/docs/config-file/environment-variables",
      "digest": "sha256:cffbbce1739188271eeae03fed45d5fe2231ee69e0b59fbb3ff6d3c7b888fa07"
    },
    {
      "id": "codex-user-skill-fixture",
      "kind": "executable-fixture",
      "path": "fixtures/codex/0.144/user-skill-discovery",
      "digest": "sha256:cffbbce1739188271eeae03fed45d5fe2231ee69e0b59fbb3ff6d3c7b888fa07"
    }
  ],
  "capabilities": {
    "skill": {
      "discover": "EXACT",
      "parse": "EXACT",
      "normalize": "EXACT",
      "resolve": "EXACT",
      "compile": "PARTIAL",
      "verify": "PARTIAL",
      "reconcileMode": "PATCHED",
      "verificationMethods": ["static-resolver", "host-list"]
    }
  },
  "precedencePrograms": [
    {
      "id": "codex.skills.discovery",
      "identity": "skill-name-plus-source",
      "operator": "KEEP_BOTH",
      "fixture": "codex-user-skill-fixture"
    }
  ],
  "knownUnknowns": [
    "whether every app surface shares the CLI discovery cache"
  ]
}
